{
  "version": "1.2.2",
  "runtime": "codex",
  "review_contract": {
    "schema_version": "2.0",
    "policy_ref": "references/independent-review-policy.md",
    "manifest_schema": "contracts/review-artifact-manifest.schema.json",
    "spawned_output_schema": "contracts/spawned-agent-output.schema.json",
    "runtime_receipt_schema": "contracts/review-runtime-receipt.schema.json",
    "independence_class_source": "runtime_receipt",
    "eligibility_field": "independent_review_eligible",
    "full_protocol_eligible_classes": [
      "separate-model",
      "external-tool",
      "human"
    ],
    "supplementary_review_classes": [
      "same-model-separate-context"
    ],
    "non_independent_review_classes": [
      "same-model-self-review"
    ],
    "spawn_event_is_independence_proof": false,
    "input_output_runtime_hashes_required": true,
    "authoring_identity_comparison_required": true,
    "unknown_runtime_metadata_policy": "downgrade-not-fabricate"
  },
  "agents": [
    {
      "agent_id": "bayesian-decision-modeler",
      "prompt_path": "agents/bayesian-decision-modeler.md",
      "spawnable": false,
      "default_execution_surface": "inline_only",
      "allowed_workflows": [
        "biomedical-research-council",
        "idea-discovery-team",
        "experiment-design-team",
        "translational-scout-team"
      ],
      "required_output_schema": "contracts/role-output.schema.json",
      "privacy_level": "public_or_local_private",
      "recommended_modes": [
        "standard",
        "deep"
      ]
    },
    {
      "agent_id": "biostats-repro-auditor",
      "prompt_path": "agents/biostats-repro-auditor.md",
      "spawnable": true,
      "default_execution_surface": "spawned_reviewer",
      "allowed_workflows": [
        "biomedical-research-council",
        "omics-analysis-team",
        "evidence-audit-team",
        "experiment-design-team"
      ],
      "required_output_schema": "contracts/spawned-agent-output.schema.json",
      "privacy_level": "public_or_local_private",
      "recommended_modes": [
        "deep",
        "audit",
        "run"
      ],
      "toml_template_path": "codex-agents/biostats-repro-auditor.toml"
    },
    {
      "agent_id": "bulk-deg-analyst",
      "prompt_path": "agents/bulk-deg-analyst.md",
      "spawnable": false,
      "default_execution_surface": "inline_only",
      "allowed_workflows": [
        "omics-analysis-team"
      ],
      "required_output_schema": "contracts/role-output.schema.json",
      "privacy_level": "public_or_local_private",
      "recommended_modes": [
        "plan",
        "run"
      ]
    },
    {
      "agent_id": "bulk-rnaseq-pipeline-specialist",
      "prompt_path": "agents/bulk-rnaseq-pipeline-specialist.md",
      "spawnable": true,
      "default_execution_surface": "spawned_reviewer",
      "allowed_workflows": [
        "omics-analysis-team"
      ],
      "required_output_schema": "contracts/spawned-agent-output.schema.json",
      "privacy_level": "public_or_local_private",
      "recommended_modes": [
        "run",
        "audit"
      ],
      "toml_template_path": "codex-agents/bulk-rnaseq-pipeline-specialist.toml"
    },
    {
      "agent_id": "causal-inference-confounder-analyst",
      "prompt_path": "agents/causal-inference-confounder-analyst.md",
      "spawnable": true,
      "default_execution_surface": "spawned_reviewer",
      "allowed_workflows": [
        "biomedical-research-council",
        "idea-discovery-team",
        "omics-analysis-team",
        "evidence-audit-team",
        "experiment-design-team",
        "translational-scout-team"
      ],
      "required_output_schema": "contracts/spawned-agent-output.schema.json",
      "privacy_level": "public_or_local_private",
      "recommended_modes": [
        "deep",
        "audit"
      ],
      "toml_template_path": "codex-agents/causal-inference-confounder-analyst.toml"
    },
    {
      "agent_id": "central-claim-ledger-evidence-graph",
      "prompt_path": "agents/central-claim-ledger-evidence-graph.md",
      "spawnable": false,
      "default_execution_surface": "inline_only",
      "allowed_workflows": [
        "biomedical-research-council",
        "idea-discovery-team",
        "omics-analysis-team",
        "evidence-audit-team",
        "experiment-design-team",
        "translational-scout-team"
      ],
      "required_output_schema": "contracts/role-output.schema.json",
      "privacy_level": "public_or_local_private",
      "recommended_modes": [
        "standard",
        "deep",
        "audit",
        "run"
      ]
    },
    {
      "agent_id": "citation-verifier",
      "prompt_path": "agents/citation-verifier.md",
      "spawnable": true,
      "default_execution_surface": "spawned_reviewer",
      "allowed_workflows": [
        "biomedical-research-council",
        "idea-discovery-team",
        "omics-analysis-team",
        "evidence-audit-team",
        "experiment-design-team",
        "translational-scout-team"
      ],
      "required_output_schema": "contracts/spawned-agent-output.schema.json",
      "privacy_level": "public_only",
      "recommended_modes": [
        "standard",
        "deep",
        "audit"
      ],
      "toml_template_path": "codex-agents/citation-verifier.toml"
    },
    {
      "agent_id": "claim-level-evidence-verifier",
      "prompt_path": "agents/claim-level-evidence-verifier.md",
      "spawnable": true,
      "default_execution_surface": "spawned_reviewer",
      "allowed_workflows": [
        "biomedical-research-council",
        "idea-discovery-team",
        "omics-analysis-team",
        "evidence-audit-team",
        "experiment-design-team",
        "translational-scout-team"
      ],
      "required_output_schema": "contracts/spawned-agent-output.schema.json",
      "privacy_level": "public_only",
      "recommended_modes": [
        "standard",
        "deep",
        "audit"
      ],
      "toml_template_path": "codex-agents/claim-level-evidence-verifier.toml"
    },
    {
      "agent_id": "clinical-trial-operations-scout",
      "prompt_path": "agents/clinical-trial-operations-scout.md",
      "spawnable": false,
      "default_execution_surface": "inline_only",
      "allowed_workflows": [
        "biomedical-research-council",
        "translational-scout-team"
      ],
      "required_output_schema": "contracts/role-output.schema.json",
      "privacy_level": "public_only",
      "recommended_modes": [
        "standard",
        "deep"
      ]
    },
    {
      "agent_id": "contradiction-red-team",
      "prompt_path": "agents/contradiction-red-team.md",
      "spawnable": true,
      "default_execution_surface": "spawned_reviewer",
      "allowed_workflows": [
        "biomedical-research-council",
        "idea-discovery-team",
        "omics-analysis-team",
        "evidence-audit-team",
        "experiment-design-team",
        "translational-scout-team"
      ],
      "required_output_schema": "contracts/spawned-agent-output.schema.json",
      "privacy_level": "public_or_local_private",
      "recommended_modes": [
        "deep",
        "audit"
      ],
      "toml_template_path": "codex-agents/contradiction-red-team.toml"
    },
    {
      "agent_id": "entity-normalizer",
      "prompt_path": "agents/entity-normalizer.md",
      "spawnable": false,
      "default_execution_surface": "inline_only",
      "allowed_workflows": [
        "biomedical-research-council",
        "idea-discovery-team",
        "omics-analysis-team",
        "evidence-audit-team",
        "experiment-design-team",
        "translational-scout-team"
      ],
      "required_output_schema": "contracts/role-output.schema.json",
      "privacy_level": "public_or_local_private",
      "recommended_modes": [
        "quick",
        "standard",
        "deep",
        "audit",
        "plan",
        "run"
      ]
    },
    {
      "agent_id": "experimental-design-planner",
      "prompt_path": "agents/experimental-design-planner.md",
      "spawnable": false,
      "default_execution_surface": "inline_only",
      "allowed_workflows": [
        "biomedical-research-council",
        "idea-discovery-team",
        "experiment-design-team"
      ],
      "required_output_schema": "contracts/role-output.schema.json",
      "privacy_level": "local_private_with_gate",
      "recommended_modes": [
        "standard",
        "deep"
      ]
    },
    {
      "agent_id": "figure-schematic-director",
      "prompt_path": "agents/figure-schematic-director.md",
      "spawnable": false,
      "default_execution_surface": "inline_only",
      "allowed_workflows": [
        "biomedical-research-council",
        "experiment-design-team"
      ],
      "required_output_schema": "contracts/role-output.schema.json",
      "privacy_level": "local_private_with_gate",
      "recommended_modes": [
        "standard",
        "deep"
      ]
    },
    {
      "agent_id": "grant-ip-landscape-scout",
      "prompt_path": "agents/grant-ip-landscape-scout.md",
      "spawnable": false,
      "default_execution_surface": "inline_only",
      "allowed_workflows": [
        "biomedical-research-council",
        "translational-scout-team"
      ],
      "required_output_schema": "contracts/role-output.schema.json",
      "privacy_level": "local_private_with_gate",
      "recommended_modes": [
        "standard",
        "deep"
      ]
    },
    {
      "agent_id": "hypothesis-generator",
      "prompt_path": "agents/hypothesis-generator.md",
      "spawnable": false,
      "default_execution_surface": "inline_only",
      "allowed_workflows": [
        "biomedical-research-council",
        "idea-discovery-team"
      ],
      "required_output_schema": "contracts/role-output.schema.json",
      "privacy_level": "public_or_local_private",
      "recommended_modes": [
        "standard",
        "deep"
      ]
    },
    {
      "agent_id": "hypothesis-ranker",